text,language,category,text_clean,char_len,category_merged
"নাগপুরে অভিষেক! তবু রোহিতদের দলে আগেও টেস্ট খেলেছেন ভরত, কী ভাবে?",bengali,sports,"নাগপুরে অভিষেক! তবু রোহিতদের দলে আগেও টেস্ট খেলেছেন ভরত, কী ভাবে?",65,sports
ইনিংস ব্যবধানেই হারল বাংলাদেশ,bengali,sports,ইনিংস ব্যবধানেই হারল বাংলাদেশ,29,sports
"আইপিএলে আগেই ছিটকে গিয়েছেন, এ বার বিশ্বকাপও যেতে বসেছে অধিনায়কের",bengali,sports,"আইপিএলে আগেই ছিটকে গিয়েছেন, এ বার বিশ্বকাপও যেতে বসেছে অধিনায়কের",66,sports
"কোহলি ক্যাচ ফস্কানোয় নজির নেপালের আসিফের, কী কীর্তি গড়লেন তিনি?",bengali,sports,"কোহলি ক্যাচ ফস্কানোয় নজির নেপালের আসিফের, কী কীর্তি গড়লেন তিনি?",65,sports
ক্লাব বিশ্বকাপ এর ফাইনালে রিয়াল,bengali,sports,ক্লাব বিশ্বকাপ এর ফাইনালে রিয়াল,32,sports
"রঞ্জি কোয়ার্টারে নামার আগে শক্তি বাড়ল বাংলার, ভারতীয় দল থেকে ছুটি, রাতেই শহরে মুকেশ",bengali,sports,"রঞ্জি কোয়ার্টারে নামার আগে শক্তি বাড়ল বাংলার, ভারতীয় দল থেকে ছুটি, রাতেই শহরে মুকেশ",86,sports
শ্রীলঙ্কাকে হারালো টাইগ্রেসরা,bengali,sports,শ্রীলঙ্কাকে হারালো টাইগ্রেসরা,29,sports
"সুপার কাপে মোহনবাগানের বিদায় হলেও এখনও আশা আছে ইস্টবেঙ্গলের, কী করতে হবে শেষ চারে যেতে?",bengali,sports,"সুপার কাপে মোহনবাগানের বিদায় হলেও এখনও আশা আছে ইস্টবেঙ্গলের, কী করতে হবে শেষ চারে যেতে?",88,sports
বাংলাওয়াশ ত্রিদেশীয় সিরিজের চ্যাম্পিয়ন পাকিস্তান,bengali,sports,বাংলাওয়াশ ত্রিদেশীয় সিরিজের চ্যাম্পিয়ন পাকিস্তান,51,sports
"কোচের বিরুদ্ধে বিদ্রোহ,  ১২ সেরা ফুটবলার ছাড়াই মেয়েদের বিশ্বকাপ স্পেনের  হাতে",bengali,sports,"কোচের বিরুদ্ধে বিদ্রোহ, ১২ সেরা ফুটবলার ছাড়াই মেয়েদের বিশ্বকাপ স্পেনের হাতে",77,sports
"খেলেন তাইল্যান্ডের ক্লাবে, এঁর সম্পত্তির পরিমাণ মেসি-রোনাল্ডোর মিলিত সম্পত্তির ১৮ গুণ!",bengali,sports,"খেলেন তাইল্যান্ডের ক্লাবে, এঁর সম্পত্তির পরিমাণ মেসি-রোনাল্ডোর মিলিত সম্পত্তির ১৮ গুণ!",86,sports
শীর্ষে ভারত! ক্রিকেট মাঠের বাইরের খেলায় অস্ট্রেলিয়াকে ২২১ কোটি টাকায় হারাল বাংলাদেশ,bengali,sports,শীর্ষে ভারত! ক্রিকেট মাঠের বাইরের খেলায় অস্ট্রেলিয়াকে ২২১ কোটি টাকায় হারাল বাংলাদেশ,86,sports
বছরে শয়ে শয়ে কনসার্ট করা অরিজিৎও আইপিএলে এসে ভয়ে কাঁপলেন! কেন?,bengali,sports,বছরে শয়ে শয়ে কনসার্ট করা অরিজিৎও আইপিএলে এসে ভয়ে কাঁপলেন! কেন?,65,sports
"সেমিতে কিউরা, ভারতসহ আফগানদের বিদায়",bengali,sports,"সেমিতে কিউরা, ভারতসহ আফগানদের বিদায়",36,sports
"মার্তিনেসের সামনে মাঠে মোহনবাগান, সবুজ-মেরুনে খেলবেন কারা?",bengali,sports,"মার্তিনেসের সামনে মাঠে মোহনবাগান, সবুজ-মেরুনে খেলবেন কারা?",58,sports
কেকেআর কত দিন পাবে লিটনকে? জানিয়ে দিলেন বাংলাদেশ তারকা নিজেই,bengali,sports,কেকেআর কত দিন পাবে লিটনকে? জানিয়ে দিলেন বাংলাদেশ তারকা নিজেই,61,sports
ঢাকার টার্গেট ১৬২,bengali,sports,ঢাকার টার্গেট ১৬২,17,sports
৫ কারণ: বিশ্বকাপের প্রথম ম্যাচে অস্ট্রেলিয়াকে কী ভাবে হারাল ভারত,bengali,sports,৫ কারণ: বিশ্বকাপের প্রথম ম্যাচে অস্ট্রেলিয়াকে কী ভাবে হারাল ভারত,65,sports
"নিজেদের পায়ে নিজেরাই কুড়ুল মারল আফগানরা, রান রেটের নিয়ম না জানায় হাল ছাড়ল তিন বল আগেই",bengali,sports,"নিজেদের পায়ে নিজেরাই কুড়ুল মারল আফগানরা, রান রেটের নিয়ম না জানায় হাল ছাড়ল তিন বল আগেই",90,sports
ভারত-পাক রিজ়ার্ভ ডে বিতর্কে ব্যাখ্যা শ্রীলঙ্কার,bengali,sports,ভারত-পাক রিজ়ার্ভ ডে বিতর্কে ব্যাখ্যা শ্রীলঙ্কার,48,sports
"বিশ্বের প্রথম ২০-তে প্রজ্ঞানন্দ, দাবা বিশ্বকাপে কী কী কীর্তি গড়লেন তিনি?",bengali,sports,"বিশ্বের প্রথম ২০-তে প্রজ্ঞানন্দ, দাবা বিশ্বকাপে কী কী কীর্তি গড়লেন তিনি?",73,sports
নিউজিল্যান্ডের উদ্বোধনী জুটি ভাঙলেন তাসকিন,bengali,sports,নিউজিল্যান্ডের উদ্বোধনী জুটি ভাঙলেন তাসকিন,42,sports
আফগানিস্তানকে মামুলি লক্ষ্য দিল বাংলাদেশ,bengali,sports,আফগানিস্তানকে মামুলি লক্ষ্য দিল বাংলাদেশ,40,sports
"ইসরোর মহাপরীক্ষা, চাঁদের মাটি স্পর্শ করতে চলেছে বিক্রম",bengali,technology,"ইসরোর মহাপরীক্ষা, চাঁদের মাটি স্পর্শ করতে চলেছে বিক্রম",54,technology
পৃথিবীর বাইরে সম্ভাব্য প্রাণের সন্ধান পেলেন গবেষকরা! কী বলছে বিজ্ঞান মহল,bengali,technology,পৃথিবীর বাইরে সম্ভাব্য প্রাণের সন্ধান পেলেন গবেষকরা! কী বলছে বিজ্ঞান মহল,72,technology
"Tecno Foldable Phone: ভারতে বিক্রি শুরু হয়েছে টেকনো ফ্যান্টম ভি ফ্লিপ ৫জি ফোনের, দাম কত? কী কী ফিচার রয়েছে এই ফোনে?",bengali,technology,"Tecno Foldable Phone: ভারতে বিক্রি শুরু হয়েছে টেকনো ফ্যান্টম ভি ফ্লিপ ৫জি ফোনের, দাম কত? কী কী ফিচার রয়েছে এই ফোনে?",117,technology
"Strong Password Set: প্রতারণা থেকে বাঁচতে নজর দিন পাসওয়ার্ড সেটিংসে, কীভাবে তৈরি করবেন 'স্ট্রং পাসওয়ার্ড'?",bengali,technology,"Strong Password Set: প্রতারণা থেকে বাঁচতে নজর দিন পাসওয়ার্ড সেটিংসে, কীভাবে তৈরি করবেন 'স্ট্রং পাসওয়ার্ড'?",108,technology
প্রতিযোগিতার বাজারে Nokia লঞ্চ করল ব্র্যান্ডের নয়া বাজেট ফ্রেন্ডলি স্মার্ট ফোন,bengali,technology,প্রতিযোগিতার বাজারে Nokia লঞ্চ করল ব্র্যান্ডের নয়া বাজেট ফ্রেন্ডলি স্মার্ট ফোন,79,technology
"WhatsApp গ্রুপ কলে নিয়ে আসছে বড়সড় আপডেট, জানুন বিস্তারিত",bengali,technology,"WhatsApp গ্রুপ কলে নিয়ে আসছে বড়সড় আপডেট, জানুন বিস্তারিত",59,technology
"Apple iPhone 16 vs 12: আগামী বছর লঞ্চ হতে পারে আইফোন ১৬, থাকতে পারে আইফোন ১২-র মতো ক্যামেরা",bengali,technology,"Apple iPhone 16 vs 12: আগামী বছর লঞ্চ হতে পারে আইফোন ১৬, থাকতে পারে আইফোন ১২-র মতো ক্যামেরা",91,technology
Motorola Smartphone: ফোনের ডিসপ্লে মুড়িয়ে বেঁধে নেওয়া যাবে কবজিতে ! দেখতে লাগবে স্মার্টওয়াচের মতো,bengali,technology,Motorola Smartphone: ফোনের ডিসপ্লে মুড়িয়ে বেঁধে নেওয়া যাবে কবজিতে ! দেখতে লাগবে স্মার্টওয়াচের মতো,101,technology
"জানেন, টিভির দাম কোটি পেরিয়েছে?",bengali,technology,"জানেন, টিভির দাম কোটি পেরিয়েছে?",32,technology
"জুলাইতে চন্দ্রগ্রহণ, জানাচ্ছেন বিজ্ঞানীরা",bengali,technology,"জুলাইতে চন্দ্রগ্রহণ, জানাচ্ছেন বিজ্ঞানীরা",41,technology
"Jack Dorsey: তল্লাশি ও ব্যবসা বন্ধের হুমকি দেয় ভারত, কেন্দ্রের বিরুদ্ধে মারাত্মক অভিযোগ প্রাক্তন ট্যুইটার কর্তার",bengali,technology,"Jack Dorsey: তল্লাশি ও ব্যবসা বন্ধের হুমকি দেয় ভারত, কেন্দ্রের বিরুদ্ধে মারাত্মক অভিযোগ প্রাক্তন ট্যুইটার কর্তার",113,technology
"Amazon নিয়ে আসছে Great Indian Festival Sale 2021, কী কী অফার রয়েছে?",bengali,technology,"Amazon নিয়ে আসছে Great Indian Festival Sale 2021, কী কী অফার রয়েছে?",69,technology
একসঙ্গে ভারতের সমস্ত কর্মী ছাঁটাই করল ইউসি ব্রাউজার ও ক্লাব ফ্যাক্টরি,bengali,technology,একসঙ্গে ভারতের সমস্ত কর্মী ছাঁটাই করল ইউসি ব্রাউজার ও ক্লাব ফ্যাক্টরি,69,technology
"নতুন ফিচার, একাধিক ডিভাইসে ব্যবহার করতে পারবেন আপনার হোয়াটসঅ্যাপ অ্যাকাউন্ট",bengali,technology,"নতুন ফিচার, একাধিক ডিভাইসে ব্যবহার করতে পারবেন আপনার হোয়াটসঅ্যাপ অ্যাকাউন্ট",76,technology
"Redmi 12C: আরও বেশি স্টোরেজ, বাড়ছে র‍্যামের পরিমাণও, রেডমি ১২সি ভারতে আসছে নতুন ভ্যারিয়েন্টে",bengali,technology,"Redmi 12C: আরও বেশি স্টোরেজ, বাড়ছে র্যামের পরিমাণও, রেডমি ১২সি ভারতে আসছে নতুন ভ্যারিয়েন্টে",93,technology
নতুন ডিসপ্লে ট্রেন্ডে গা ভাসালো Honor,bengali,technology,নতুন ডিসপ্লে ট্রেন্ডে গা ভাসালো Honor,37,technology
ভারতের বাজারে লঞ্চ হল Redmi 10 Prime এবং Redmi Earbuds 3 Pro,bengali,technology,ভারতের বাজারে লঞ্চ হল Redmi 10 Prime এবং Redmi Earbuds 3 Pro,60,technology
"YouTube: গান শুনতে শুনতেই লিরিক্স দেখার সুযোগ, ইউজারদের জন্য নতুন পরিষেবা আনছে ইউটিউব",bengali,technology,"YouTube: গান শুনতে শুনতেই লিরিক্স দেখার সুযোগ, ইউজারদের জন্য নতুন পরিষেবা আনছে ইউটিউব",85,technology
"লেনোভো HX03F, বাজারে এল ১৯৯৯ টাকার নতুন স্মার্টওয়াচ",bengali,technology,"লেনোভো HX03F, বাজারে এল ১৯৯৯ টাকার নতুন স্মার্টওয়াচ",52,technology
OnePlus 6: ফোনটিকে ঘিরে উপচে পড়ছে অভিযোগ,bengali,technology,OnePlus 6: ফোনটিকে ঘিরে উপচে পড়ছে অভিযোগ,41,technology
"ব্যর্থতাকে সঙ্গে নিয়ে আগামী বছর চাঁদে নামতে চলেছে চন্দ্রযান-৩, প্রস্তুতি শুরু ইসরোতে",bengali,technology,"ব্যর্থতাকে সঙ্গে নিয়ে আগামী বছর চাঁদে নামতে চলেছে চন্দ্রযান-৩, প্রস্তুতি শুরু ইসরোতে",85,technology
"পুজোর আগে খাবার ডেলিভারিতে নামছে অ্যামাজন, মিলবে চাকরি",bengali,technology,"পুজোর আগে খাবার ডেলিভারিতে নামছে অ্যামাজন, মিলবে চাকরি",54,technology
"ভুয়ো তথ্য রোধে এগিয়ে আসবে Google, Meta সহ একাধিক সোশ্যাল মিডিয়া জায়েন্ট",bengali,technology,"ভুয়ো তথ্য রোধে এগিয়ে আসবে Google, Meta সহ একাধিক সোশ্যাল মিডিয়া জায়েন্ট",75,technology
শাওমি বাজারে আনছে এস সিরিজের নতুন ফোন রেডমি এস টু,bengali,technology,শাওমি বাজারে আনছে এস সিরিজের নতুন ফোন রেডমি এস টু,49,technology
"OnePlus বাজারে নিয়ে আসছে বাজেট ফ্রেন্ডলি স্মার্টফোন, সাধ্যের মধ্যেই দাম",bengali,technology,"OnePlus বাজারে নিয়ে আসছে বাজেট ফ্রেন্ডলি স্মার্টফোন, সাধ্যের মধ্যেই দাম",72,technology
"নতুন আদলে শাওমি, চার দিকেই থাকবে এজ্ ডিসপ্লে",bengali,technology,"নতুন আদলে শাওমি, চার দিকেই থাকবে এজ্ ডিসপ্লে",44,technology
Oppo F21 Pro লঞ্চ কবে? ফাঁস হল দিনক্ষণ,bengali,technology,Oppo F21 Pro লঞ্চ কবে? ফাঁস হল দিনক্ষণ,38,technology
WhatsApp Desktop app এখন সরাসরি Windows অ্যাপ স্টোরে পেয়ে যান,bengali,technology,WhatsApp Desktop app এখন সরাসরি Windows অ্যাপ স্টোরে পেয়ে যান,62,technology
"বছরের শেষ চন্দ্রগ্রহণ আগামী ৩০ নভেম্বর, ভারতে দেখা যাবে কি?",bengali,technology,"বছরের শেষ চন্দ্রগ্রহণ আগামী ৩০ নভেম্বর, ভারতে দেখা যাবে কি?",59,technology
"একবার ক্লিক, চলতে শুরু করবে সমস্ত ভয়েস মেসেজ",bengali,technology,"একবার ক্লিক, চলতে শুরু করবে সমস্ত ভয়েস মেসেজ",45,technology
Tata Harrier Facelift: পুরনোর থেকে কতটা আলাদা ? নতুন টাটা হ্যারিয়ার ফেসলিফ্টে কী রয়েছে ?,bengali,technology,Tata Harrier Facelift: পুরনোর থেকে কতটা আলাদা ? নতুন টাটা হ্যারিয়ার ফেসলিফ্টে কী রয়েছে ?,90,technology
"Vivo V23 সিরিজের হোলি অফার, থাকছে আকর্ষণীয় ছাড়",bengali,technology,"Vivo V23 সিরিজের হোলি অফার, থাকছে আকর্ষণীয় ছাড়",48,technology
নিষেধাজ্ঞার উপর পাল্টা মামলা দায়ের করার পরিকল্পনা টিকটকের,bengali,technology,নিষেধাজ্ঞার উপর পাল্টা মামলা দায়ের করার পরিকল্পনা টিকটকের,58,technology
AC Maintain Tips: এসি চালালেও নিয়ন্ত্রণে থাকবে ইলেকট্রিক বিল! একটু বুদ্ধি খাটালেই মুশকিল আসান,bengali,technology,AC Maintain Tips: এসি চালালেও নিয়ন্ত্রণে থাকবে ইলেকট্রিক বিল! একটু বুদ্ধি খাটালেই মুশকিল আসান,94,technology
ওয়াটার রেসিস্টেন্স সাপোর্ট-সহ বাজেট ফ্রেন্ডলি সেরা ৫ স্মার্টফোন,bengali,technology,ওয়াটার রেসিস্টেন্স সাপোর্ট-সহ বাজেট ফ্রেন্ডলি সেরা ৫ স্মার্টফোন,64,technology
"হ্যাঁ, এতগুলোই ক্যামেরা থাকবে স্যামসাংয়ের আসন্ন ফোনে",bengali,technology,"হ্যাঁ, এতগুলোই ক্যামেরা থাকবে স্যামসাংয়ের আসন্ন ফোনে",53,technology
মার্ক জুকারবার্গ কেন বললেন অ্যান্ড্রয়েড ফোন ব্যবহার করতে ?,bengali,technology,মার্ক জুকারবার্গ কেন বললেন অ্যান্ড্রয়েড ফোন ব্যবহার করতে ?,59,technology
লাদাখকে চিনের অংশ হিসাবে দেখানোয় সংসদীয় কমিটির প্রশ্নের মুখে Twitter,bengali,technology,লাদাখকে চিনের অংশ হিসাবে দেখানোয় সংসদীয় কমিটির প্রশ্নের মুখে Twitter,70,technology
Samsung’s Galaxy Note 9 এর বদল ঘটল প্রসেসরের,bengali,technology,Samsung’s Galaxy Note 9 এর বদল ঘটল প্রসেসরের,44,technology
ভারতে লঞ্চ হতে চলেছে Nokia 7.1 Plus,bengali,technology,ভারতে লঞ্চ হতে চলেছে Nokia 7.1 Plus,35,technology
Chandrayaan 2: কেন চাঁদে যাওয়ার এত আগ্রহ সকলের?,bengali,technology,Chandrayaan 2: কেন চাঁদে যাওয়ার এত আগ্রহ সকলের?,48,technology
"পুজো শুরু ফ্লিপকার্টে, অফুরন্ত অফারে Asus Zenfone 5Z থেকে Samsung Galaxy S8",bengali,technology,"পুজো শুরু ফ্লিপকার্টে, অফুরন্ত অফারে Asus Zenfone 5Z থেকে Samsung Galaxy S8",75,technology
"কীভাবে চ্যানেল প্যাক বাছবেন এয়ারটেল, টাটা স্কাই, ডিশ টিভির গ্রাহকরা?",bengali,technology,"কীভাবে চ্যানেল প্যাক বাছবেন এয়ারটেল, টাটা স্কাই, ডিশ টিভির গ্রাহকরা?",69,technology
অফুরন্ত জলের ভাণ্ডার ছিল লাল গ্রহটি! কীভাবে প্রাণহীন হয়ে উঠল মঙ্গল?,bengali,technology,অফুরন্ত জলের ভাণ্ডার ছিল লাল গ্রহটি! কীভাবে প্রাণহীন হয়ে উঠল মঙ্গল?,68,technology
"Layoffs: বিশ্বে চাকরি গেছে ২.২১ লক্ষেরও বেশি কর্মীর, ভারতে কতজন কাজ হারিয়েছে জানেন ?",bengali,technology,"Layoffs: বিশ্বে চাকরি গেছে ২.২১ লক্ষেরও বেশি কর্মীর, ভারতে কতজন কাজ হারিয়েছে জানেন ?",85,technology
ভিআইপি ফোন নম্বর নিতে চান? জানুন উপায়,bengali,technology,ভিআইপি ফোন নম্বর নিতে চান? জানুন উপায়,38,technology
"ঝকঝকে ক্যামেরা, নজরকাড়া ডিজাইন! ভারতে লঞ্চ হল Nothing Phone 1",bengali,technology,"ঝকঝকে ক্যামেরা, নজরকাড়া ডিজাইন! ভারতে লঞ্চ হল Nothing Phone 1",62,technology
"মহাকাশ গবেষণায় নজির, ভারতের প্রথম বেসরকারি রকেটের সফল উৎক্ষেপণ",bengali,technology,"মহাকাশ গবেষণায় নজির, ভারতের প্রথম বেসরকারি রকেটের সফল উৎক্ষেপণ",63,technology
"Redmi Note 10 Lite লঞ্চ হল ভারতে, জেনে নিন দাম, আকর্ষণীয় ফিচার সম্পর্কে",bengali,technology,"Redmi Note 10 Lite লঞ্চ হল ভারতে, জেনে নিন দাম, আকর্ষণীয় ফিচার সম্পর্কে",72,technology
"Google Drive সার্চ চিপস ফিচার, জেনে নিন বিস্তারিত",bengali,technology,"Google Drive সার্চ চিপস ফিচার, জেনে নিন বিস্তারিত",49,technology
স্যামসাং এর 4x fun কি ?,bengali,technology,স্যামসাং এর 4x fun কি ?,23,technology
