text,language,category,text_clean,char_len,category_merged
"एमएस धोनी को लेकर परवेज मुशर्रफ ने किया था सवाल, सौरव गांगुली ने बंद कर दी थी पाकिस्तानी तानाशाह की बोलती",hindi,international,"एमएस धोनी को लेकर परवेज मुशर्रफ ने किया था सवाल, सौरव गांगुली ने बंद कर दी थी पाकिस्तानी तानाशाह की बोलती",105,international
"अमेरिकन स्टाइल में इजरायल ने गाजा पर दागे 70 से ज्यादा रॉकेट, तायसीर जबारी को मारने का दावा",hindi,international,"अमेरिकन स्टाइल में इजरायल ने गाजा पर दागे 70 से ज्यादा रॉकेट, तायसीर जबारी को मारने का दावा",91,international
"India-China LAC पर ‘स्थिर’ हैं हालात, Tawang Clash पर चीन का पहला रिएक्शन, 8-9 दिसंबर को भारत के जवानों ने PLA Troopes को खदेड़ा था",hindi,international,"India-China LAC पर ‘स्थिर’ हैं हालात, Tawang Clash पर चीन का पहला रिएक्शन, 8-9 दिसंबर को भारत के जवानों ने PLA Troopes को खदेड़ा था",131,international
"इराक में विरोध प्रदर्शन के दौरान भड़की हिंसा, 1 की मौत-8 घायल, किरकुक शहर में लगा कर्फ्यू",hindi,international,"इराक में विरोध प्रदर्शन के दौरान भड़की हिंसा, 1 की मौत-8 घायल, किरकुक शहर में लगा कर्फ्यू",89,international
"मोक्सिला उपाध्याय: भारतवंशी न्यायाधीश, जिन्होंने पूर्व अमेरिकी राष्ट्रपति ट्रंप को दी चेतावनी",hindi,international,"मोक्सिला उपाध्याय: भारतवंशी न्यायाधीश, जिन्होंने पूर्व अमेरिकी राष्ट्रपति ट्रंप को दी चेतावनी",93,international
"पत्नी ने ना कहा तो पति दूसरी महिला को ले आया घर, मशहूर मॉडल ने लिया ख़ौफ़नाक बदला",hindi,international,"पत्नी ने ना कहा तो पति दूसरी महिला को ले आया घर, मशहूर मॉडल ने लिया ख़ौफ़नाक बदला",81,international
"Pakistan News: इस्लामाबाद हाई कोर्ट से इमरान खान को झटका, अयोग्यता के फैसले को दी थी चुनौती, HC ने खारिज की याचिका",hindi,international,"Pakistan News: इस्लामाबाद हाई कोर्ट से इमरान खान को झटका, अयोग्यता के फैसले को दी थी चुनौती, HC ने खारिज की याचिका",114,international
"दुनिया का वो महाठग, जिसने ना अमीर देखा ना गरीब, सभी को जमकर लूटा, 136 देशों में 37 हजार लोग बने थे उसका शिकार",hindi,international,"दुनिया का वो महाठग, जिसने ना अमीर देखा ना गरीब, सभी को जमकर लूटा, 136 देशों में 37 हजार लोग बने थे उसका शिकार",109,international
"Express Adda: ‘इश्क कभी होता था तकरार का मुद्दा’, करण जौहर बोले- चॉइस और ओपिनियन ने प्यार के क्षेत्र में किया पेनेट्रेट",hindi,national,"Express Adda: ‘इश्क कभी होता था तकरार का मुद्दा’, करण जौहर बोले- चॉइस और ओपिनियन ने प्यार के क्षेत्र में किया पेनेट्रेट",119,politics_national
बदहाल पाकिस्तान और भारत की चुनौतियां,hindi,politics,बदहाल पाकिस्तान और भारत की चुनौतियां,36,politics_national
राजनीतिः विकास की राजनीति,hindi,politics,राजनीतिः विकास की राजनीति,25,politics_national
राजनीति: चुनौती बनती साइबर सुरक्षा,hindi,politics,राजनीति: चुनौती बनती साइबर सुरक्षा,34,politics_national
राजनीतिः ब्याज व्यवहारिक दर जरूरी,hindi,politics,राजनीतिः ब्याज व्यवहारिक दर जरूरी,33,politics_national
"Sonia-Rahul Gandhi: सोनिया और राहुल गांधी के प्लेन की भोपाल में इमरजेंसी लैंडिंग, बेंगलुरु से लौट रहे थे दिल्ली",hindi,national,"Sonia-Rahul Gandhi: सोनिया और राहुल गांधी के प्लेन की भोपाल में इमरजेंसी लैंडिंग, बेंगलुरु से लौट रहे थे दिल्ली",111,politics_national
राजनीति: अफगान वार्ता और कूटनीति,hindi,politics,राजनीति: अफगान वार्ता और कूटनीति,32,politics_national
"विकास के बजाय उपहार का सहारा, सभी दलों में चुनाव जीतने के लिए मुफ्त रेवड़ी की घोषणा एक आसान उपाय",hindi,politics,"विकास के बजाय उपहार का सहारा, सभी दलों में चुनाव जीतने के लिए मुफ्त रेवड़ी की घोषणा एक आसान उपाय",96,politics_national
"ममता बनर्जी ने एक्टर राकेश रोशन को बना दिया देश का पहला अंतरिक्ष यात्री, बोलीं- इंदिरा गांधी ने जब…",hindi,national,"ममता बनर्जी ने एक्टर राकेश रोशन को बना दिया देश का पहला अंतरिक्ष यात्री, बोलीं- इंदिरा गांधी ने जब…",99,politics_national
लैंगिक समानता की अदृश्य बाधाएं,hindi,politics,लैंगिक समानता की अदृश्य बाधाएं,30,politics_national
"IMD Weather: दिल्ली-NCR समेत यूपी में मानसून पर लगा ब्रेक! तेजी से बढ़ेगा पारा, जानें अपने शहर का हाल",hindi,national,"IMD Weather: दिल्ली-NCR समेत यूपी में मानसून पर लगा ब्रेक! तेजी से बढ़ेगा पारा, जानें अपने शहर का हाल",101,politics_national
"जींद में गरजे अमित शाह- भाजपा ने दिए ‘भ्रष्टाचार-मुक्त’ सरकार, पहले था ‘करप्शन-युक्त’ सरकार",hindi,politics,"जींद में गरजे अमित शाह- भाजपा ने दिए ‘भ्रष्टाचार-मुक्त’ सरकार, पहले था ‘करप्शन-युक्त’ सरकार",91,politics_national
राजनीति: डिजिटल युग और ग्रामीण विकास,hindi,politics,राजनीति: डिजिटल युग और ग्रामीण विकास,36,politics_national
"क्रिकेट का BJP कनेक्शन: अमित शाह के बेटे BCCI सचिव, हेमंत बिस्व सरमा के सहयोगी संयुक्त सचिव, भाजपा विधायक ट्रेजरर",hindi,politics,"क्रिकेट का BJP कनेक्शन: अमित शाह के बेटे BCCI सचिव, हेमंत बिस्व सरमा के सहयोगी संयुक्त सचिव, भाजपा विधायक ट्रेजरर",113,politics_national
ओजोन क्षरण के खतरे,hindi,politics,ओजोन क्षरण के खतरे,18,politics_national
"ममता बनर्जी के बाद प्रशांत किशोर ने भी राहुल गांधी पर साधा निशाना, बोले- इन्हें कोई दैवीय अधिकार नहीं मिले हैं",hindi,politics,"ममता बनर्जी के बाद प्रशांत किशोर ने भी राहुल गांधी पर साधा निशाना, बोले- इन्हें कोई दैवीय अधिकार नहीं मिले हैं",110,politics_national
"Rajasthan Election: ‘अभी तो गांधीवादी संघर्ष था, मांगें नहीं मानी तो…’ अशोक गहलोत को पायलट का सीधा अल्टीमेटम",hindi,politics,"Rajasthan Election: ‘अभी तो गांधीवादी संघर्ष था, मांगें नहीं मानी तो…’ अशोक गहलोत को पायलट का सीधा अल्टीमेटम",108,politics_national
राजनीतिः गांधी जी का स्वदेशी और हम,hindi,politics,राजनीतिः गांधी जी का स्वदेशी और हम,34,politics_national
"कर्नाटक HC के छह जजों को जान से मारने की धमकी, दुबई गैंग ने पाकिस्तान के बैंक में 50 लाख जमा कराने को कहा",hindi,national,"कर्नाटक HC के छह जजों को जान से मारने की धमकी, दुबई गैंग ने पाकिस्तान के बैंक में 50 लाख जमा कराने को कहा",105,politics_national
"कांग्रेस ने शेयर किया सिद्धारमैया-डीके शिवकुमार की दोस्ती का VIDEO, बीजेपी ने मौज ले ली!",hindi,politics,"कांग्रेस ने शेयर किया सिद्धारमैया-डीके शिवकुमार की दोस्ती का VIDEO, बीजेपी ने मौज ले ली!",88,politics_national
"हिंदुत्व हिंदुस्तान की आत्मा है, इसी वजह से भारत बना पंथनिरपेक्ष- बोले केंद्रीय मंत्री मुख्तार अब्बास नकवी",hindi,politics,"हिंदुत्व हिंदुस्तान की आत्मा है, इसी वजह से भारत बना पंथनिरपेक्ष- बोले केंद्रीय मंत्री मुख्तार अब्बास नकवी",106,politics_national
राजनीति: नशे की गिरफ्त में कामकाजी महिलाएं,hindi,politics,राजनीति: नशे की गिरफ्त में कामकाजी महिलाएं,42,politics_national
"पश्चिम बंगाल में रामराज्य के लिए BJP को दें मौका, रिपब्लिक डिबेट में बोले मनोज तिवारी- ‘लंका में जब अत्याचार बढ़ा तब विभीषण को रावण का..’",hindi,politics,"पश्चिम बंगाल में रामराज्य के लिए BJP को दें मौका, रिपब्लिक डिबेट में बोले मनोज तिवारी- ‘लंका में जब अत्याचार बढ़ा तब विभीषण को रावण का..’",137,politics_national
"Himachal Pradesh: लैंडस्लाइड से 71 की मौत, 700 सड़कें ब्लॉक, स्कूल-होटल जमींदोज… हिमाचल CM बोले- उबरने में लगेगा एक साल",hindi,national,"Himachal Pradesh: लैंडस्लाइड से 71 की मौत, 700 सड़कें ब्लॉक, स्कूल-होटल जमींदोज… हिमाचल CM बोले- उबरने में लगेगा एक साल",119,politics_national
"Jansatta Editorial: आसियान के साथ भारत का जुड़ाव न केवल व्यापारिक, बल्कि पूर्वोत्तर में संतुलन साधने के लिए भी महत्त्वपूर्ण",hindi,national,"Jansatta Editorial: आसियान के साथ भारत का जुड़ाव न केवल व्यापारिक, बल्कि पूर्वोत्तर में संतुलन साधने के लिए भी महत्त्वपूर्ण",123,politics_national
"JNU विवादः योगी आदित्यनाथ बोले, संस्थानों में पैदा हुए जिन्ना तो वहीं कर देंगे दफन",hindi,politics,"JNU विवादः योगी आदित्यनाथ बोले, संस्थानों में पैदा हुए जिन्ना तो वहीं कर देंगे दफन",82,politics_national
"ISKCON पर आरोप लगाकर फंसीं मेनका गांधी, ट्रस्ट ने भेजा 100 करोड़ का मानहानि नोटिस",hindi,national,"ISKCON पर आरोप लगाकर फंसीं मेनका गांधी, ट्रस्ट ने भेजा 100 करोड़ का मानहानि नोटिस",81,politics_national
कोरोना संकट से निपटने में नरेंद्र मोदी कामयाब- इंडिया टुडे के पोल में ज्यादातर लोगों की राय,hindi,politics,कोरोना संकट से निपटने में नरेंद्र मोदी कामयाब- इंडिया टुडे के पोल में ज्यादातर लोगों की राय,91,politics_national
"‘काले कपड़ों वालों का भविष्य भी काला है, इसलिए काले कौवे भी…’,  विपक्षी नेताओं पर पीयूष गोयल ने किया बड़ा हमला",hindi,national,"‘काले कपड़ों वालों का भविष्य भी काला है, इसलिए काले कौवे भी…’, विपक्षी नेताओं पर पीयूष गोयल ने किया बड़ा हमला",109,politics_national
राजनीति: कारोबारी सुगमता के लिए,hindi,politics,राजनीति: कारोबारी सुगमता के लिए,31,politics_national
"चार साल बाद हाउस अरेस्ट से बाहर निकले मीरवाइज उमर फारूक, श्रीनगर की जामा मस्जिद में जाकर अदा की नमाज",hindi,national,"चार साल बाद हाउस अरेस्ट से बाहर निकले मीरवाइज उमर फारूक, श्रीनगर की जामा मस्जिद में जाकर अदा की नमाज",100,politics_national
"तीन साल में 1073 करोड़, केजरीवाल सरकार के विज्ञापन का खर्च देख भड़के जस्टिस, सिंघवी को दे डाली चेतावनी",hindi,national,"तीन साल में 1073 करोड़, केजरीवाल सरकार के विज्ञापन का खर्च देख भड़के जस्टिस, सिंघवी को दे डाली चेतावनी",102,politics_national
एटमी हथियारों से मुक्ति का सपना,hindi,politics,एटमी हथियारों से मुक्ति का सपना,31,politics_national
"मथुरा का श्रीकृष्ण जन्मभूमि मामला पैदा कर सकता है विवाद, हाईकोर्ट ही सुनवाई करे तो बेहतर रहेगा- बोला सुप्रीम कोर्ट",hindi,national,"मथुरा का श्रीकृष्ण जन्मभूमि मामला पैदा कर सकता है विवाद, हाईकोर्ट ही सुनवाई करे तो बेहतर रहेगा- बोला सुप्रीम कोर्ट",114,politics_national
"BJP प्रवक्‍ता संबित पात्रा के खिलाफ कोर्ट पहुंचीं कांग्रेस नेता रीता बहुगुणा, बताया था हिन्दू विरोधी",hindi,politics,"BJP प्रवक्ता संबित पात्रा के खिलाफ कोर्ट पहुंचीं कांग्रेस नेता रीता बहुगुणा, बताया था हिन्दू विरोधी",99,politics_national
Maharashtra Politics: क्या ऋषि सुनक ने एकनाथ शिंदे से पूछा उद्धव ठाकरे का हालचाल? CM ने कही चौंकाने वाली बात,hindi,national,Maharashtra Politics: क्या ऋषि सुनक ने एकनाथ शिंदे से पूछा उद्धव ठाकरे का हालचाल? CM ने कही चौंकाने वाली बात,108,politics_national
पीएम मोदी के मुकाबले बढ़ रही है राहुल गांधी की लोकप्रियता! इस दावे की हो रही है चर्चा,hindi,national,पीएम मोदी के मुकाबले बढ़ रही है राहुल गांधी की लोकप्रियता! इस दावे की हो रही है चर्चा,85,politics_national
"हरियाणा में बढ़ने जा रही BJP की मुसीबत! बीरेंद्र सिंह भाजपा के झंडों के बिना करेंगे रैली, भीम आर्मी और किसान यूनियन को बुलाया, जानिए इनसाइड स्टोरी",hindi,national,"हरियाणा में बढ़ने जा रही BJP की मुसीबत! बीरेंद्र सिंह भाजपा के झंडों के बिना करेंगे रैली, भीम आर्मी और किसान यूनियन को बुलाया, जानिए इनसाइड स्टोरी",146,politics_national
"‘कौन-क्या खाएगा ये हम तय नहीं कर सकते…’, सुप्रीम कोर्ट ने दिया बड़ा फैसला, यह है पूरा मामला",hindi,national,"‘कौन-क्या खाएगा ये हम तय नहीं कर सकते…’, सुप्रीम कोर्ट ने दिया बड़ा फैसला, यह है पूरा मामला",91,politics_national
"पश्चिम बंगाल के शिक्षक भरती घोटाले में अभिषेक बनर्जी को बड़ी राहत, हाईकोर्ट ने ईडी को कहा- सख्त कदम न उठाए",hindi,national,"पश्चिम बंगाल के शिक्षक भरती घोटाले में अभिषेक बनर्जी को बड़ी राहत, हाईकोर्ट ने ईडी को कहा- सख्त कदम न उठाए",106,politics_national
राजनीतिः प्रदूषण की चपेट में जिंदगी,hindi,politics,राजनीतिः प्रदूषण की चपेट में जिंदगी,35,politics_national
"Manipur Violence: ‘हमारे आंतरिक मामलों में दखल न दें’, मणिपुर के मुख्यमंत्री की मिजोरम CM को दो टूक",hindi,national,"Manipur Violence: ‘हमारे आंतरिक मामलों में दखल न दें’, मणिपुर के मुख्यमंत्री की मिजोरम CM को दो टूक",99,politics_national
नोटा की सार्थकता और लोकतंत्र,hindi,politics,नोटा की सार्थकता और लोकतंत्र,28,politics_national
राजनीतिः खतरे में उद्यम,hindi,politics,राजनीतिः खतरे में उद्यम,23,politics_national
जी20 शिखर सम्मेलन: विकासशील देशों के लिए वित्त पोषण का सवाल अहम,hindi,national,जी20 शिखर सम्मेलन: विकासशील देशों के लिए वित्त पोषण का सवाल अहम,63,politics_national
"शायर इमरान प्रतापगढ़ी बोले- कल एग्जिट पोल की बकैती आज ईवीएम की डकैती, एक्ट्रेस ने कहा- आप क्रोनोलोजी समझिए",hindi,politics,"शायर इमरान प्रतापगढ़ी बोले- कल एग्जिट पोल की बकैती आज ईवीएम की डकैती, एक्ट्रेस ने कहा- आप क्रोनोलोजी समझिए",106,politics_national
राजनीतिः ई-सिगरेट भी कम घातक नहीं,hindi,politics,राजनीतिः ई-सिगरेट भी कम घातक नहीं,33,politics_national
"G20 Summit: चीन के राष्ट्रपति शी जिनपिंग के नई दिल्ली आने की संभावना कम, पुतिन भी जता चुके हैं असमर्थता",hindi,national,"G20 Summit: चीन के राष्ट्रपति शी जिनपिंग के नई दिल्ली आने की संभावना कम, पुतिन भी जता चुके हैं असमर्थता",103,politics_national
