text,language,category,text_clean,char_len,category_merged
Biological E Gets Govt Panel Nod To Manufacture 14-Valent Pneumococcal Conjugate Vaccine For Infants. All About It,english,technology,Biological E Gets Govt Panel Nod To Manufacture 14-Valent Pneumococcal Conjugate Vaccine For Infants. All About It,114,technology
"Wordle 702 Answer, May 22: Check Out Hints And Clues To Solve Today's Wordle Puzzle",english,technology,"Wordle 702 Answer, May 22: Check Out Hints And Clues To Solve Today's Wordle Puzzle",83,technology
"ISRO Shares Images Of Chandrayaan-3 Captured By Chandrayaan-2's Orbiter, Then Deletes Post",english,technology,"ISRO Shares Images Of Chandrayaan-3 Captured By Chandrayaan-2's Orbiter, Then Deletes Post",90,technology
Study Finds Two New Omicron Symptoms In UK Patients. Everything You Need To Know,english,technology,Study Finds Two New Omicron Symptoms In UK Patients. Everything You Need To Know,80,technology
James Webb Space Telescope's First Image Of Neptune Gives 'Clearest' Look At Its Rings In Decades,english,technology,James Webb Space Telescope's First Image Of Neptune Gives 'Clearest' Look At Its Rings In Decades,97,technology
Intel To Lay Off 235 Employees In 5th Round Of Job Cuts This Year,english,technology,Intel To Lay Off 235 Employees In 5th Round Of Job Cuts This Year,65,technology
"Bing Suffered Due To Google-Apple Default Search Engine Arrangement, Microsoft CEO Satya Nadella Says In US Court",english,technology,"Bing Suffered Due To Google-Apple Default Search Engine Arrangement, Microsoft CEO Satya Nadella Says In US Court",113,technology
Read Amazon VP's Memo To Employees As Amazon Prepares To Cut More Jobs,english,technology,Read Amazon VP's Memo To Employees As Amazon Prepares To Cut More Jobs,70,technology
Christopher Nolan's Hand-Drawn 'Inception' Plot Map Goes Viral: What It Tells Us About The Multiple Dream Layers,english,technology,Christopher Nolan's Hand-Drawn 'Inception' Plot Map Goes Viral: What It Tells Us About The Multiple Dream Layers,112,technology
"Women’s Day 2023: Are Hot Flashes Common During Menopause? Expert Debunks Myths, Reveals Facts",english,technology,"Women’s Day 2023: Are Hot Flashes Common During Menopause? Expert Debunks Myths, Reveals Facts",94,technology
"Weekly Tech Wrap: Data Protection Bill Passes, Online Gaming GST Burdens Cos, Scams On Instagram & WhatsApp",english,technology,"Weekly Tech Wrap: Data Protection Bill Passes, Online Gaming GST Burdens Cos, Scams On Instagram & WhatsApp",107,technology
"For A Billion Years In The Past, Earth Had 19-Hour Days, Study Suggests",english,technology,"For A Billion Years In The Past, Earth Had 19-Hour Days, Study Suggests",71,technology
"Chandrayaan-3's Vikram Lander Payload Records Pragyan Rover's Movements, Detects A Natural Event",english,technology,"Chandrayaan-3's Vikram Lander Payload Records Pragyan Rover's Movements, Detects A Natural Event",96,technology
"This New Device Can Detect And Analyse Cancer Cells From Blood, To Do Away With Need For Invasive Surgery: Study",english,technology,"This New Device Can Detect And Analyse Cancer Cells From Blood, To Do Away With Need For Invasive Surgery: Study",112,technology
Bharat Biotech's Nasal COVID Vaccine Receives Govt Nod For Use As Heterologous Booster In Adults,english,technology,Bharat Biotech's Nasal COVID Vaccine Receives Govt Nod For Use As Heterologous Booster In Adults,96,technology
"US To Put AI Under Scanner, Aims To Understand Impact On Workers",english,technology,"US To Put AI Under Scanner, Aims To Understand Impact On Workers",64,technology
Want A Power Bank That Can Charge Your Notebook? Check Out These 5 Options,english,technology,Want A Power Bank That Can Charge Your Notebook? Check Out These 5 Options,74,technology
"Women’s Day 2023: Infertility Causes May Be Hormonal Or Anatomical, Stress Reduction Can Prevent It, Experts Say",english,technology,"Women’s Day 2023: Infertility Causes May Be Hormonal Or Anatomical, Stress Reduction Can Prevent It, Experts Say",112,technology
US Racing Driver To Pilot NASA's Second Private Astronaut Mission To Space Station,english,technology,US Racing Driver To Pilot NASA's Second Private Astronaut Mission To Space Station,82,technology
"Dutch Researcher Develops Search Engine AGNES, A 'Google For Archaeologists'",english,technology,"Dutch Researcher Develops Search Engine AGNES, A 'Google For Archaeologists'",76,technology
"Ice Cream Therapy, Constipated Scorpions, Blind Dates — Studies That Won Researchers 2022 Ig Nobel",english,technology,"Ice Cream Therapy, Constipated Scorpions, Blind Dates — Studies That Won Researchers 2022 Ig Nobel",98,technology
"LinkedIn Letting Users Verify Themselves, Their Work Through New Ways",english,technology,"LinkedIn Letting Users Verify Themselves, Their Work Through New Ways",69,technology
Grinning Gourd: NASA's Spitzer Captures Jack-O'-Lantern Nebula Decorating Milky Way. See PIC,english,technology,Grinning Gourd: NASA's Spitzer Captures Jack-O'-Lantern Nebula Decorating Milky Way. See PIC,92,technology
How Two-Wheeled Robots Will Supersede Mars Rovers And Enable Longer Exploration Missions,english,technology,How Two-Wheeled Robots Will Supersede Mars Rovers And Enable Longer Exploration Missions,88,technology
"Bats Create Sounds Like Death Metal Singers, Study Says Their Octave Range Exceeds That Of Mariah Carey",english,technology,"Bats Create Sounds Like Death Metal Singers, Study Says Their Octave Range Exceeds That Of Mariah Carey",103,technology
"Samsung Galaxy M34 Challengers: OnePlus Nord CE 3 Lite, Redmi Note 12, More",english,technology,"Samsung Galaxy M34 Challengers: OnePlus Nord CE 3 Lite, Redmi Note 12, More",75,technology
YouTube Director And Head Of Security Explains How It Will Deal With Users Who Don't Disclose Synthetic Content Amid Rise In Deepfakes,english,technology,YouTube Director And Head Of Security Explains How It Will Deal With Users Who Don't Disclose Synthetic Content Amid Rise In Deepfakes,134,technology
IBM To Acquire Software Firm Apptio For $4.6 Billion To Bolster Cloud Offering,english,technology,IBM To Acquire Software Firm Apptio For $4.6 Billion To Bolster Cloud Offering,78,technology
Tech Tips: 10 Ways You Can Enhance Your Chrome Experience On Android,english,technology,Tech Tips: 10 Ways You Can Enhance Your Chrome Experience On Android,68,technology
"Tech-ing Care Of Cows: How Machine Learning, Blockchain Can Help Track Stray Cattle And Modernise Cow-Based Economy",english,technology,"Tech-ing Care Of Cows: How Machine Learning, Blockchain Can Help Track Stray Cattle And Modernise Cow-Based Economy",115,technology
"Xiaomi Pad 6: Price, Specifications, Everything Else You Need To Know",english,technology,"Xiaomi Pad 6: Price, Specifications, Everything Else You Need To Know",69,technology
"Xiaomi Pad 5, Samsung Galaxy Tab S7 FE, More: 5 Challengers To OnePlus Pad",english,technology,"Xiaomi Pad 5, Samsung Galaxy Tab S7 FE, More: 5 Challengers To OnePlus Pad",74,technology
Male Infants Born To Mothers With Covid-19 During Pregnancy At Higher Risk Of Neurodevelopmental Disorders: Study,english,technology,Male Infants Born To Mothers With Covid-19 During Pregnancy At Higher Risk Of Neurodevelopmental Disorders: Study,113,technology
Astronomer Carl Sagan Death Anniversary: Know About The Pioneer In US Space Program And Research Of Extrasolar Planets,english,technology,Astronomer Carl Sagan Death Anniversary: Know About The Pioneer In US Space Program And Research Of Extrasolar Planets,118,technology
"Perseids, Cygnus The Swan, Veil Nebula, Planet Parade – What To Watch In The August Sky And When",english,technology,"Perseids, Cygnus The Swan, Veil Nebula, Planet Parade – What To Watch In The August Sky And When",96,technology
Battery Swapping: How It Can Benefit E-mobility Transition,english,technology,Battery Swapping: How It Can Benefit E-mobility Transition,58,technology
Google Has Laid Off Hundreds Of Employees In Recruitment Division,english,technology,Google Has Laid Off Hundreds Of Employees In Recruitment Division,65,technology
Opera Integrates ChatGPT To Bring AI Prompts For Users,english,technology,Opera Integrates ChatGPT To Bring AI Prompts For Users,54,technology
Apple Festive Sale Kicks Off On October 15: Discounts And What Else To Expect,english,technology,Apple Festive Sale Kicks Off On October 15: Discounts And What Else To Expect,77,technology
"Amazon Sale 2023: Top Smartphones Under Rs 25,00 From OnePlus, Realme, More",english,technology,"Amazon Sale 2023: Top Smartphones Under Rs 25,00 From OnePlus, Realme, More",75,technology
"Deepfakes To Disinformation: Year 2023 Brought A New Era Of Digital Deception, Driven By AI",english,technology,"Deepfakes To Disinformation: Year 2023 Brought A New Era Of Digital Deception, Driven By AI",91,technology
"TikTok Takes On X, Threads With Text-Only Posts: All You Need To Know",english,technology,"TikTok Takes On X, Threads With Text-Only Posts: All You Need To Know",69,technology
"Antioxidant Flavonols Found In Fruits, Tea Associated With Slower Memory Decline: Study",english,technology,"Antioxidant Flavonols Found In Fruits, Tea Associated With Slower Memory Decline: Study",87,technology
"'Well Capitalised... Long Way Ahead': Amid Layoff News, Koo Says There Will Be Better Times",english,technology,"'Well Capitalised... Long Way Ahead': Amid Layoff News, Koo Says There Will Be Better Times",91,technology
Treasure Chest Of Data: James Webb Space Telescope Spots Dusty Clouds On Planet Orbiting Two Stars,english,technology,Treasure Chest Of Data: James Webb Space Telescope Spots Dusty Clouds On Planet Orbiting Two Stars,98,technology
How EV Three-Wheelers Are Transforming India's Last-Mile Transportation,english,technology,How EV Three-Wheelers Are Transforming India's Last-Mile Transportation,71,technology
"'For The Youth, Touching The Sky Is...': PM Modi On India's Feats In Space Sector",english,technology,"'For The Youth, Touching The Sky Is...': PM Modi On India's Feats In Space Sector",81,technology
Years Vs Genetic Variation: What Matters More In Determining How One Ages?,english,technology,Years Vs Genetic Variation: What Matters More In Determining How One Ages?,74,technology
Explained: What Is Electronic Interlocking? The System Linked With The Odisha Triple-Train Collision,english,technology,Explained: What Is Electronic Interlocking? The System Linked With The Odisha Triple-Train Collision,100,technology
Chandrayaan-3: ISRO All Set To Initiate Automatic Landing Sequence To Activate Throttleable Engines For Descent,english,technology,Chandrayaan-3: ISRO All Set To Initiate Automatic Landing Sequence To Activate Throttleable Engines For Descent,111,technology
"Instagram, Facebook Users Will Soon Be Able To Edit Or Create Videos Using Text Prompts, Thanks To Gen AI",english,technology,"Instagram, Facebook Users Will Soon Be Able To Edit Or Create Videos Using Text Prompts, Thanks To Gen AI",105,technology
"Air Pollution: PM2.5 Levels Post Diwali In 9 Indian Capital Cities Higher In 2023 Than 2022, Delhi Records Highest Spike",english,technology,"Air Pollution: PM2.5 Levels Post Diwali In 9 Indian Capital Cities Higher In 2023 Than 2022, Delhi Records Highest Spike",120,technology
Giant Stars Are Losing Weight Dramatically. New Study Explains Why They Slim Down,english,technology,Giant Stars Are Losing Weight Dramatically. New Study Explains Why They Slim Down,81,technology
"GSLV Mk-III, Cartosat-3, GSAT-11 — India Launched 27 Satellite Missions And 25 Launch Vehicles In 5 Years",english,technology,"GSLV Mk-III, Cartosat-3, GSAT-11 — India Launched 27 Satellite Missions And 25 Launch Vehicles In 5 Years",105,technology
Scientists Identify Giant Eagle That Fed On Kangaroos And Koalas Lakhs Of Years Ago,english,technology,Scientists Identify Giant Eagle That Fed On Kangaroos And Koalas Lakhs Of Years Ago,83,technology
What Is The 'Call Before u Dig' App Launched By PM Modi Today,english,technology,What Is The 'Call Before u Dig' App Launched By PM Modi Today,61,technology
"TikTok, Telegram, 1XBet Banned By Somalia Over Indecent Content, Propaganda",english,technology,"TikTok, Telegram, 1XBet Banned By Somalia Over Indecent Content, Propaganda",75,technology
WHO Gives Nod To Biological E As Additional Production Site For Johnson & Johnson Covid Vaccine Janssen,english,technology,WHO Gives Nod To Biological E As Additional Production Site For Johnson & Johnson Covid Vaccine Janssen,103,technology
SII Working With US Firm To Launch Omicron-Specific Covid Vaccine After Six Months: Adar Poonawalla,english,technology,SII Working With US Firm To Launch Omicron-Specific Covid Vaccine After Six Months: Adar Poonawalla,99,technology
Biden Administration Initiates Public Input For AI Safety Standards And Testing: All You Need To Know,english,technology,Biden Administration Initiates Public Input For AI Safety Standards And Testing: All You Need To Know,101,technology
"Bombay HC Pulls Up I-T Dept, Orders Tax Refund Of Rs 1,128 Crore To Vodafone Idea; Vi Shares Rise 2.49%",english,technology,"Bombay HC Pulls Up I-T Dept, Orders Tax Refund Of Rs 1,128 Crore To Vodafone Idea; Vi Shares Rise 2.49%",103,technology
CERT-In Issues Caution Against Critical Flaw In These Samsung Phones,english,technology,CERT-In Issues Caution Against Critical Flaw In These Samsung Phones,68,technology
Rare Mineral On Mars Created As A Result Of Volcanic Eruption: Study,english,technology,Rare Mineral On Mars Created As A Result Of Volcanic Eruption: Study,68,technology
Online Disinformation Intensifies Amid Israel-Hamas Conflict: Report,english,technology,Online Disinformation Intensifies Amid Israel-Hamas Conflict: Report,68,technology
AI Systems Need To Be Safe Before Public Release: US Prez Joe Biden,english,technology,AI Systems Need To Be Safe Before Public Release: US Prez Joe Biden,67,technology
"India Likely To Get 'Below Normal' Monsoon Rain This Year, Says Skymet Weather. Here's Why",english,technology,"India Likely To Get 'Below Normal' Monsoon Rain This Year, Says Skymet Weather. Here's Why",90,technology
Chandrayaan-3 Landing: See First Glimpse Of Rover Pragyan Coming Out On Ramp,english,technology,Chandrayaan-3 Landing: See First Glimpse Of Rover Pragyan Coming Out On Ramp,76,technology
"Cryptocurrency Price Today: Bitcoin, Ethereum, Other Top Coins Register Minor Gains",english,technology,"Cryptocurrency Price Today: Bitcoin, Ethereum, Other Top Coins Register Minor Gains",83,technology
Elon Musk Reiterates Call For 'Truth-Seeking AI' To Counter Rival ChatGPT,english,technology,Elon Musk Reiterates Call For 'Truth-Seeking AI' To Counter Rival ChatGPT,73,technology
"Threads FAQs: Character Limit, How To Sign Up, All Your Questions Answered",english,technology,"Threads FAQs: Character Limit, How To Sign Up, All Your Questions Answered",74,technology
Leonardo da Vinci's Forgotten Work On Gravity: Study Examines What He Got Right And Wrong,english,technology,Leonardo da Vinci's Forgotten Work On Gravity: Study Examines What He Got Right And Wrong,89,technology
OnePlus And Oppo May Soon Bring Phones With Whopping 24GB Of RAM,english,technology,OnePlus And Oppo May Soon Bring Phones With Whopping 24GB Of RAM,64,technology
"Edward Wilson, ‘Modern-Day Darwin’ Whose Scientific Discovery Led To ‘Half-Earth’, Dies",english,technology,"Edward Wilson, ‘Modern-Day Darwin’ Whose Scientific Discovery Led To ‘Half-Earth’, Dies",87,technology
Apple Classical Music App Is Now Available On Android,english,technology,Apple Classical Music App Is Now Available On Android,53,technology
Oppo Is Pulling The Plug On Its Chip Design Unit. Here's Why,english,technology,Oppo Is Pulling The Plug On Its Chip Design Unit. Here's Why,60,technology
"India-Centric Features To Come With iOS 17: Bilingual Siri, Transliteration Keyboards In More Indian Languages",english,technology,"India-Centric Features To Come With iOS 17: Bilingual Siri, Transliteration Keyboards In More Indian Languages",110,technology
"'Joy, Gratefulness...': ISRO Chief On Chandrayaan-3 Success, Why South Pole Was Chosen And Aditya L1",english,technology,"'Joy, Gratefulness...': ISRO Chief On Chandrayaan-3 Success, Why South Pole Was Chosen And Aditya L1",100,technology
"Amazon Diwali 2023 Sale: Sony, LG, Samsung, More TVs Available At Lucrative Discounts. Check Out Top 5 Deals",english,technology,"Amazon Diwali 2023 Sale: Sony, LG, Samsung, More TVs Available At Lucrative Discounts. Check Out Top 5 Deals",108,technology
"Redmi 12 5G FAQs: Price, Display, Camera, Specifications, Everything Else You Need To Know",english,technology,"Redmi 12 5G FAQs: Price, Display, Camera, Specifications, Everything Else You Need To Know",90,technology
Google Doodle Today: Google Celebrates Birth Anniversary Of Biophysicist Mária Telkes. All About Her,english,technology,Google Doodle Today: Google Celebrates Birth Anniversary Of Biophysicist Mária Telkes. All About Her,100,technology
Samsung Galaxy S23 FE Launching Soon? Device Appears On 3C Certification Website,english,technology,Samsung Galaxy S23 FE Launching Soon? Device Appears On 3C Certification Website,80,technology
India’s Internet Economy To Hit $1 Trillion Mark By 2030 With GDP Contribution Of Around 12%: Google Joint Report,english,technology,India’s Internet Economy To Hit $1 Trillion Mark By 2030 With GDP Contribution Of Around 12%: Google Joint Report,113,technology
"BGMI Unban: Battlegrounds Mobile India To Be Available For Download Soon, Will Be On 90-Day Trial",english,technology,"BGMI Unban: Battlegrounds Mobile India To Be Available For Download Soon, Will Be On 90-Day Trial",97,technology
ISRO Successfully Conducts Flight Acceptance Test Of Engine That Will Power LVM3 For Chandrayaan-3,english,technology,ISRO Successfully Conducts Flight Acceptance Test Of Engine That Will Power LVM3 For Chandrayaan-3,98,technology
India Will Never Bargain On Medicine Quality: Mansukh Mandaviya As WHO Flags 7 India-Manufactured Cough Syrups,english,technology,India Will Never Bargain On Medicine Quality: Mansukh Mandaviya As WHO Flags 7 India-Manufactured Cough Syrups,110,technology
World Tuberculosis Day: In What Instances Does Latent TB Infection Become Active? Here’s What Experts Say,english,technology,World Tuberculosis Day: In What Instances Does Latent TB Infection Become Active? Here’s What Experts Say,105,technology
iPhone 15 Pre-Orders Begin At 5:30 PM In India Today,english,technology,iPhone 15 Pre-Orders Begin At 5:30 PM In India Today,52,technology
French Radiation Watchdog ANFR Asks Apple To Stop Selling iPhone 12 Over Radiation Concerns,english,technology,French Radiation Watchdog ANFR Asks Apple To Stop Selling iPhone 12 Over Radiation Concerns,91,technology
"Cat Parasite Hijacks The Identity Of Immune Cells To Spread Inside The Human Body, Study Finds",english,technology,"Cat Parasite Hijacks The Identity Of Immune Cells To Spread Inside The Human Body, Study Finds",94,technology
"Amazon Great Indian Festival Sale: iPhone 13 Available Under Rs 50,000. Check Out More Smartphone Deals",english,technology,"Amazon Great Indian Festival Sale: iPhone 13 Available Under Rs 50,000. Check Out More Smartphone Deals",103,technology
WhatsApp Channels Gets Stickers As It Crosses 500 Monthly Active Users,english,technology,WhatsApp Channels Gets Stickers As It Crosses 500 Monthly Active Users,70,technology
Explained: What Is EG.5.1? New Covid-19 Variant Nicknamed ‘Eris’ Rapidly Spreading In The UK,english,technology,Explained: What Is EG.5.1? New Covid-19 Variant Nicknamed ‘Eris’ Rapidly Spreading In The UK,92,technology
Online Gaming GST FAQs: Are Any Games Exempt From 28% Tax? How Will It Impact Players’ Wins? All Your Questions Answered,english,technology,Online Gaming GST FAQs: Are Any Games Exempt From 28% Tax? How Will It Impact Players’ Wins? All Your Questions Answered,120,technology
74% Workers In India Worried About AI Replacing Their Jobs: Microsoft Report,english,technology,74% Workers In India Worried About AI Replacing Their Jobs: Microsoft Report,76,technology
Statistics Day 2023: What This Year's Theme On 'Monitoring Sustainable Development Goals' Means,english,technology,Statistics Day 2023: What This Year's Theme On 'Monitoring Sustainable Development Goals' Means,95,technology
Future Of Blockchain Development In India: How Angular Framework Can Play A Key Role,english,technology,Future Of Blockchain Development In India: How Angular Framework Can Play A Key Role,84,technology
Twitter Removes 'Government-Funded' Labels From Media Accounts,english,technology,Twitter Removes 'Government-Funded' Labels From Media Accounts,62,technology
Google Pixel Phones May Be Manufactured In India Soon,english,technology,Google Pixel Phones May Be Manufactured In India Soon,53,technology
Quordle 660 Hints & Answers: Check Out The Quordle Words For November 15,english,technology,Quordle 660 Hints & Answers: Check Out The Quordle Words For November 15,72,technology
"शरीर पर बिजली की तार लपेट नजर आईं ‘ये रिश्ता क्या कहलाता है’ की एक्ट्रेस, लोगों ने कहा-दुनिया का आठवां अजूबा",hindi,entertainment,"शरीर पर बिजली की तार लपेट नजर आईं ‘ये रिश्ता क्या कहलाता है’ की एक्ट्रेस, लोगों ने कहा-दुनिया का आठवां अजूबा",108,entertainment
"बॉलीवुड की वो एक्ट्रेस जिसको प्यार करना पड़ा था भारी, प्रेमी के बेटों ने करवा दी थी बेरहमी से हत्या",hindi,entertainment,"बॉलीवुड की वो एक्ट्रेस जिसको प्यार करना पड़ा था भारी, प्रेमी के बेटों ने करवा दी थी बेरहमी से हत्या",99,entertainment
राहुल गांधी ने सुसाइड से बचाया; कन्रड़ एक्ट्रेस राम्या उर्फ दिव्या स्पंदना ने किया खुलासा,hindi,entertainment,राहुल गांधी ने सुसाइड से बचाया; कन्रड़ एक्ट्रेस राम्या उर्फ दिव्या स्पंदना ने किया खुलासा,89,entertainment
"प्रियंका चोपड़ा ने पति निक जोनस संग की ऑटो की सवारी, बॉलीवुड एक्टर का तंज- मुझे डर है कि एक दिन निक…",hindi,entertainment,"प्रियंका चोपड़ा ने पति निक जोनस संग की ऑटो की सवारी, बॉलीवुड एक्टर का तंज- मुझे डर है कि एक दिन निक…",100,entertainment
क्या अहान शेट्टी ने गर्लफ्रेंड तानिया श्रॉफ संग कर ली है शादी? एक्टर ने खुद बताई सच्चाई,hindi,entertainment,क्या अहान शेट्टी ने गर्लफ्रेंड तानिया श्रॉफ संग कर ली है शादी? एक्टर ने खुद बताई सच्चाई,87,entertainment
"सारे भारतीय मुसलमानों को कन्वर्ट होकर हिंदू बन जाना चाहिए, उन्हें कोई बचाने नहीं आएगा- एक्टर ने दी सलाह, लोग करने लगे खिंचाई",hindi,entertainment,"सारे भारतीय मुसलमानों को कन्वर्ट होकर हिंदू बन जाना चाहिए, उन्हें कोई बचाने नहीं आएगा- एक्टर ने दी सलाह, लोग करने लगे खिंचाई",124,entertainment
"सलमान खान को ‘अंकल’ कहकर बुलाने लगीं सारा अली खान, ऐसा था एक्टर का रिएक्शन",hindi,entertainment,"सलमान खान को ‘अंकल’ कहकर बुलाने लगीं सारा अली खान, ऐसा था एक्टर का रिएक्शन",74,entertainment
"रूपा गांगुली को याद आए महाभारत के दिन, बताया- द्रौपदी बनने में लगते थे 1.5 घंटे, टीवी भी नहीं देख पाती थीं",hindi,entertainment,"रूपा गांगुली को याद आए महाभारत के दिन, बताया- द्रौपदी बनने में लगते थे 1.5 घंटे, टीवी भी नहीं देख पाती थीं",106,entertainment
